{
  "schema": "equipment-design-agent-request-v1",
  "request_id": "PACKAGED-FORMULA-REPORT-20260718",
  "operation": "render_report",
  "payload": {
    "input": {
      "operation": "manual_match",
      "payload": {
        "selection_id": "block:PUMP",
        "values": {
          "equipment_tag": "P-PACKAGED-TEST",
          "process_function": "liquid pressure boosting",
          "phase": "liquid",
          "pressure_basis": "absolute",
          "flow_m3_h": 20,
          "inlet_pressure_mpa": 0.2,
          "outlet_pressure_mpa": 0.6,
          "density_kg_m3": 900,
          "efficiency_percent": 75
        }
      }
    },
    "format": "html",
    "output_path": "packaged_formula_report_20260718.html"
  }
}
